<!ELEMENT Company (Employee+)>
<!ATTLIST Company 
          xmlns:xsi CDATA #IMPLIED
          xsi:noNamespaceSchemaLocation CDATA #IMPLIED>
<!ELEMENT Employee (FirstName,LastName,ContactNo,Email,Address)>
<!ELEMENT Address (City,State,Zip)>
<!ELEMENT FirstName (#PCDATA)>
<!ELEMENT LastName (#PCDATA)>
<!ELEMENT ContactNo (#PCDATA)>
<!ELEMENT Email (#PCDATA)>
<!ELEMENT City (#PCDATA)>
<!ELEMENT State (#PCDATA)>
<!ELEMENT Zip (#PCDATA)>